{
  "taskId": "TASK-0009",
  "title": "Product SEO content migration and admin image upload",
  "status": "development",
  "owner": "developer",
  "risk": {
    "database": false,
    "destructiveDatabase": false,
    "security": true,
    "payment": false,
    "inventory": false,
    "pricing": false,
    "production": true
  },
  "artifacts": {
    "requirement": ".ai/tasks/TASK-0009/requirement.md",
    "plan": ".ai/tasks/TASK-0009/plan.md",
    "architecture": ".ai/tasks/TASK-0009/architecture.md"
  },
  "history": [
    {
      "from": null,
      "to": "requirement",
      "by": "planner",
      "evidence": "requirement.md"
    },
    {
      "from": "requirement",
      "to": "planning",
      "by": "planner",
      "evidence": "plan.md"
    },
    {
      "from": "planning",
      "to": "architecture",
      "by": "architect",
      "evidence": "architecture.md"
    },
    {
      "from": "architecture",
      "to": "development",
      "by": "developer",
      "evidence": "Implementation in progress"
    }
  ]
}
