{
  "taskId": "TASK-0006",
  "title": "Agent execution contract",
  "status": "development",
  "owner": "developer",
  "risk": {
    "database": false,
    "destructiveDatabase": false,
    "security": true,
    "payment": false,
    "inventory": false,
    "pricing": false,
    "production": false
  },
  "artifacts": {
    "requirement": ".ai/tasks/TASK-0006/requirement.md",
    "plan": ".ai/tasks/TASK-0006/plan.md",
    "architecture": ".ai/tasks/TASK-0006/architecture.md"
  },
  "history": [
    {
      "from": null,
      "to": "requirement",
      "by": "planner",
      "evidence": "requirement.md"
    },
    {
      "from": "requirement",
      "to": "planning",
      "by": "planner",
      "evidence": "plan.md"
    },
    {
      "from": "planning",
      "to": "architecture",
      "by": "architect",
      "evidence": "architecture.md"
    },
    {
      "from": "architecture",
      "to": "development",
      "by": "developer",
      "evidence": "Implement execution packet boundary"
    }
  ]
}
